{
	"$schema": "../../../meta/definitions/card.schema.json",
	"attacks": [
		{
			"cost": [
				"Colorless"
			],
			"name": {
				"en": "Bite",
				"fr": "Morsure"
			},
			"damage": 10
		},
		{
			"cost": [
				"Darkness",
				"Colorless"
			],
			"name": {
				"en": "Plunder",
				"fr": "Pillage"
			},
			"effect": {
				"en": "Before doing damage, discard all Trainer cards attached to the Defending Pokémon.",
				"fr": "Avant d'infliger les dégâts, défaussez toutes les cartes Dresseur attachées au Pokémon Défenseur (avant qu'elles agissent sur les dégâts)."
			},
			"damage": 20
		}
	],
	"category": "Pokemon",
	"description": {
		"fr": "Il utilise différents types d'aboiements pour communiquer avec les autres de son espèce et pour chasser sa proie."
	},
	"dexId": [
		228
	],
	"hp": 40,
	"illustrator": "Shin-ichi Yoshida",
	"name": {
		"en": "Houndour",
		"fr": "Malosse"
	},
	"rarity": "Uncommon",
	"resistances": [
		{
			"type": "Psychic",
			"value": "-30"
		}
	],
	"set": "neo2",
	"stage": "Basic",
	"types": [
		"Darkness"
	]
}