{
	"$schema": "../../../meta/definitions/card.schema.json",
	"attacks": [
		{
			"cost": [
				"Fairy"
			],
			"name": {
				"en": "Cotton Guard",
				"fr": "Cotogarde",
				"es": "Rizo Algodón",
				"it": "Cotonscudo",
				"pt": "Proteção de Algodão",
				"de": "Watteschild"
			},
			"effect": {
				"en": "During your opponent’s next turn, this Pokémon takes 10 less damage from attacks (after applying Weakness and Resistance).",
				"fr": "Pendant le prochain tour de votre adversaire, ce Pokémon subit 10 dégâts de moins provenant des attaques (après application de la Faiblesse et de la Résistance).",
				"es": "Durante el próximo turno de tu rival, los ataques hacen 10 puntos de daño menos a este Pokémon (después de aplicar Debilidad y Resistencia).",
				"it": "Durante il prossimo turno del tuo avversario, questo Pokémon subisce 10 danni in meno dagli attacchi, dopo aver applicato debolezza e resistenza.",
				"pt": "Durante a próxima vez de jogar do seu oponente, este Pokémon receberá 10 pontos de dano a menos de ataques (após a aplicação de Fraqueza e Resistência).",
				"de": "Während des nächsten Zuges deines Gegners werden diesem Pokémon durch Attacken 10 Schadenspunkte weniger zugefügt (nachdem Schwäche und Resistenz verrechnet wurden)."
			},
			"damage": 10
		}
	],
	"category": "Pokemon",
	"dexId": [
		684
	],
	"hp": 60,
	"illustrator": "MAHOU",
	"name": {
		"de": "Flauschling",
		"en": "Swirlix",
		"es": "Swirlix",
		"fr": "Sucroquin",
		"it": "Swirlix",
		"pt": "Swirlix"
	},
	"rarity": "Common",
	"resistances": [
		{
			"type": "Darkness",
			"value": "-20"
		}
	],
	"retreat": 1,
	"set": "sm12",
	"stage": "Basic",
	"types": [
		"Fairy"
	],
	"weaknesses": [
		{
			"type": "Metal",
			"value": "×2"
		}
	]
}