{
	"$schema": "../../../meta/definitions/card.schema.json",
	"attacks": [
		{
			"cost": [
				"Grass"
			],
			"name": {
				"en": "Surprise Attack",
				"fr": "Attaque Surprise",
				"es": "Ataque Sorpresa",
				"it": "Attacco a Sorpresa",
				"pt": "Ataque Surpresa",
				"de": "Überraschungsangriff"
			},
			"effect": {
				"en": "Flip a coin. If tails, this attack does nothing.",
				"fr": "Lancez une pièce. Si c’est pile, cette attaque ne fait rien.",
				"es": "Lanza 1 moneda. Si sale cruz, este ataque no hace nada.",
				"it": "Lancia una moneta. Se esce croce, questo attacco non ha effetto.",
				"pt": "Jogue 1 moeda. Se sair coroa, este ataque não fará nada.",
				"de": "Wirf 1 Münze. Bei Zahl hat diese Attacke keine Auswirkungen."
			},
			"damage": 30
		}
	],
	"category": "Pokemon",
	"dexId": [
		420
	],
	"hp": 50,
	"illustrator": "Asako Ito",
	"name": {
		"de": "Kikugi",
		"en": "Cherubi",
		"es": "Cherubi",
		"fr": "Ceribou",
		"it": "Cherubi",
		"pt": "Cherubi"
	},
	"rarity": "Common",
	"retreat": 1,
	"set": "sm5",
	"stage": "Basic",
	"types": [
		"Grass"
	],
	"weaknesses": [
		{
			"type": "Fire",
			"value": "×2"
		}
	]
}