{
	"$schema": "../../../meta/definitions/card.schema.json",
	"attacks": [
		{
			"cost": [
				"Darkness"
			],
			"name": {
				"en": "Shadow Bind",
				"fr": "Étreinte d'ombre"
			},
			"effect": {
				"en": "The Defending Pokémon can't retreat until the end of your opponent's next turn.",
				"fr": "Le Pokémon Défenseur ne peut pas battre en retraite tant que le prochain tour de votre adversaire n'est pas terminé."
			},
			"damage": 10
		}
	],
	"category": "Pokemon",
	"dexId": [
		261
	],
	"hp": 50,
	"illustrator": "Naoyo Kimura",
	"name": {
		"en": "Poochyena",
		"fr": "Medhyena"
	},
	"rarity": "Common",
	"resistances": [
		{
			"type": "Psychic",
			"value": "-30"
		}
	],
	"set": "ex1",
	"stage": "Basic",
	"types": [
		"Darkness"
	],
	"weaknesses": [
		{
			"type": "Fighting",
			"value": "×2"
		}
	]
}