{
	"$schema": "../../../meta/definitions/card.schema.json",
	"attacks": [
		{
			"cost": [
				"Colorless"
			],
			"name": {
				"en": "Magma Ring",
				"fr": "Anneau Magma",
				"es": "Anillo de Magma",
				"it": "Anello di Magma",
				"pt": "Anel de Magma",
				"de": "Magmaring"
			},
			"effect": {
				"en": "The Defending Pokémon can’t retreat during your opponent’s next turn.",
				"fr": "Le Pokémon Défenseur ne peut pas battre en retraite pendant le prochain tour de votre adversaire.",
				"es": "El Pokémon Defensor no puede retirarse durante el próximo turno de tu rival.",
				"it": "Durante il prossimo turno del tuo avversario, il Pokémon difensore non può ritirarsi.",
				"pt": "O Pokémon Defensor não poderá recuar durante a próxima vez de jogar do seu oponente.",
				"de": "Das Verteidigende Pokémon kann sich während des nächsten Zuges deines Gegners nicht zurückziehen."
			},
			"damage": 10
		},
		{
			"cost": [
				"Fire",
				"Colorless"
			],
			"name": {
				"en": "Flare",
				"fr": "Intimidation",
				"es": "Llama",
				"it": "Fiammata",
				"pt": "Labareda",
				"de": "Flackern"
			},
			"damage": 20
		}
	],
	"category": "Pokemon",
	"dexId": [
		218
	],
	"hp": 70,
	"illustrator": "Midori Harada",
	"name": {
		"de": "Schneckmag",
		"en": "Slugma",
		"es": "Slugma",
		"fr": "Limagma",
		"it": "Slugma",
		"pt": "Slugma"
	},
	"rarity": "Common",
	"retreat": 2,
	"set": "sm7",
	"stage": "Basic",
	"types": [
		"Fire"
	],
	"weaknesses": [
		{
			"type": "Water",
			"value": "×2"
		}
	]
}