{
	"$schema": "../../../meta/definitions/card.schema.json",
	"category": "Trainer",
	"effect": {
		"fr": "Vous ne pouvez jouer qu'une seule carte Supporter par tour. Lorsque vous jouez cette carte, placez-la à côté de votre Pokémon Actif. À la fin de votre tour, défaussez-la.\n\nDéfaussez 1 Pokémon de votre main. Ensuite, piochez 3 cartes. Si vous avez défaussé un Pokémon dont le nom comporte Team Aqua, piochez 4 cartes."
	},
	"illustrator": "Ken Sugimori",
	"name": {
		"en": "Team Aqua Schemer",
		"fr": "Manipulateur de Team Aqua"
	},
	"rarity": "Common",
	"set": "ex4",
	"trainerType": "Supporter"
}