{
	"$schema": "../../../meta/definitions/card.schema.json",
	"category": "Trainer",
	"effect": {
		"fr": "Chaque joueur compte les cartes qu’il a en main, les mélange dans son deck, puis pioche ce même nombre de cartes.",
		"en": "Each player counts the cards in their hand, shuffles those cards into their deck, then draws that many cards.",
		"es": "Cada jugador cuenta las cartas de su mano, pone esas cartas en su baraja y las baraja todas, y después roba ese mismo número de cartas.",
		"it": "Ciascun giocatore conta le carte che ha in mano, le rimischia nel proprio mazzo, quindi pesca lo stesso numero di carte.",
		"pt": "Cada jogador conta as cartas nas próprias mãos, embaralha-as no próprio baralho e em seguida compra aquele mesmo número de cartas.",
		"de": "Jeder Spieler zählt die Karten auf seiner Hand, mischt jene Karten in sein Deck und zieht anschließend dieselbe Anzahl Karten."
	},
	"illustrator": "take",
	"name": {
		"de": "Pia",
		"en": "Wicke",
		"es": "Zyra",
		"fr": "Vicky",
		"it": "Ciceria",
		"pt": "Lara"
	},
	"rarity": "Uncommon",
	"set": "sm3",
	"trainerType": "Supporter"
}