{
	"$schema": "../../../meta/definitions/card.schema.json",
	"attacks": [
		{
			"cost": [
				"Colorless"
			],
			"name": {
				"en": "Ram"
			},
			"damage": 10
		},
		{
			"cost": [
				"Colorless",
				"Colorless"
			],
			"name": {
				"en": "Bug Bite"
			},
			"damage": 20
		}
	],
	"category": "Pokemon",
	"dexId": [
		595
	],
	"hp": 30,
	"illustrator": "MAHOU",
	"name": {
		"de": "Wattzapf",
		"en": "Joltik",
		"es": "Joltik",
		"fr": "Statitik",
		"it": "Joltik",
		"pt": "Joltik"
	},
	"rarity": "Common",
	"retreat": 1,
	"set": "bw5",
	"stage": "Basic",
	"types": [
		"Lightning"
	],
	"weaknesses": [
		{
			"type": "Fighting",
			"value": "Ã—2"
		}
	]
}