{
	"$schema": "../../../meta/definitions/card.schema.json",
	"attacks": [
		{
			"name": {
				"en": "Gnaw",
				"fr": "Rogne"
			},
			"damage": 10
		},
		{
			"cost": [
				"Colorless"
			],
			"name": {
				"en": "Sand Attack",
				"fr": "Jet de sable"
			},
			"effect": {
				"en": "If the Defending Pokémon tries to attack during your opponent's next turn, your opponent flips a coin. If tails, that attack does nothing.",
				"fr": "Si le Pokémon Défenseur essaye d'attaquer lors du prochain tour de votre adversaire, celui-ci lance une pièce. Si c'est pile, cette attaque est sans effet."
			}
		}
	],
	"category": "Pokemon",
	"dexId": [
		133
	],
	"hp": 60,
	"illustrator": "Kagemaru Himeno",
	"name": {
		"en": "Eevee",
		"fr": "Evoli"
	},
	"rarity": "Common",
	"retreat": 1,
	"set": "dp5",
	"stage": "Basic",
	"types": [
		"Colorless"
	],
	"weaknesses": [
		{
			"type": "Fighting",
			"value": "+10"
		}
	]
}