{
	"$schema": "../../../meta/definitions/card.schema.json",
	"attacks": [
		{
			"cost": [
				"Fighting",
				"Metal"
			],
			"name": {
				"en": "Lunge",
				"fr": "Coup Rapide"
			},
			"effect": {
				"en": "Flip a coin. If tails, this attack does nothing.",
				"fr": "Lancez une pièce. Si c'est pile, cette attaque ne fait rien."
			},
			"damage": 30
		}
	],
	"category": "Pokemon",
	"dexId": [
		610
	],
	"hp": 50,
	"illustrator": "TOKIYA",
	"name": {
		"en": "Axew",
		"fr": "Coupenotte"
	},
	"rarity": "Rare",
	"retreat": 1,
	"set": "dv1",
	"stage": "Basic",
	"types": [
		"Dragon"
	],
	"weaknesses": [
		{
			"type": "Dragon",
			"value": "×2"
		}
	]
}