{
	"$schema": "../../../meta/definitions/card.schema.json",
	"attacks": [
		{
			"cost": [
				"Colorless"
			],
			"name": {
				"en": "Collect",
				"fr": "Collecte"
			},
			"effect": {
				"en": "Draw a card.",
				"fr": "Piochez une carte."
			}
		},
		{
			"cost": [
				"Colorless",
				"Colorless"
			],
			"name": {
				"en": "Slam",
				"fr": "Souplesse"
			},
			"effect": {
				"en": "Flip 2 coins. This attack does 20 damage times the number of heads.",
				"fr": "Lancez 2 pièces. Cette attaque inflige 20 dégâts multipliés par le nombre de côtés face."
			},
			"damage": 20
		}
	],
	"category": "Pokemon",
	"dexId": [
		504
	],
	"hp": 50,
	"illustrator": "Naoki Saito",
	"name": {
		"de": "Nagelotz",
		"en": "Patrat",
		"es": "Patrat",
		"fr": "Ratentif",
		"it": "Patrat",
		"pt": "Patrat"
	},
	"rarity": "Common",
	"retreat": 1,
	"set": "bw8",
	"stage": "Basic",
	"types": [
		"Colorless"
	],
	"weaknesses": [
		{
			"type": "Fighting",
			"value": "×2"
		}
	]
}