{
	"$schema": "../../../meta/definitions/card.schema.json",
	"attacks": [
		{
			"cost": [
				"Colorless"
			],
			"name": {
				"en": "Spinning Attack",
				"fr": "Attaque Tournante"
			},
			"damage": 10
		},
		{
			"cost": [
				"Colorless",
				"Colorless"
			],
			"name": {
				"en": "Reverse Spin",
				"fr": "Vrille Renversante"
			},
			"effect": {
				"en": "Your opponent shuffles his or her hand into his or her deck and draws 4 cards.",
				"fr": "Votre adversaire mélange sa main avec son deck et pioche 4 cartes."
			}
		}
	],
	"category": "Pokemon",
	"dexId": [
		343
	],
	"hp": 60,
	"illustrator": "Shigenori Negishi",
	"name": {
		"de": "Puppance",
		"en": "Baltoy",
		"es": "Baltoy",
		"fr": "Balbuto",
		"it": "Baltoy",
		"pt": "Baltoy"
	},
	"rarity": "Common",
	"retreat": 1,
	"set": "bw6",
	"stage": "Basic",
	"types": [
		"Fighting"
	],
	"weaknesses": [
		{
			"type": "Grass",
			"value": "×2"
		}
	]
}