{
	"$schema": "../../../meta/definitions/card.schema.json",
	"category": "Trainer",
	"effect": {
		"fr": "Attachez Fétiche de force à un de vos Pokémon qui n'a pas d'Outil Pokémon attaché à lui.\n\nÀ chaque fois qu'une attaque du Pokémon sur lequel est attachée Fétiche de force inflige des dégâts (après application de la Faiblesse et de la Résistance), cette attaque inflige 10 dégâts supplémentaires. À la fin de votre tour où cet effet a lieu, défaussez-vous de Fétiche de force."
	},
	"illustrator": "Keiji Kinebuchi",
	"name": {
		"en": "Strength Charm",
		"fr": "Fétiche de force"
	},
	"rarity": "Uncommon",
	"set": "ecard1"
}