{
	"$schema": "../../../meta/definitions/card.schema.json",
	"attacks": [
		{
			"cost": [
				"Colorless"
			],
			"name": {
				"en": "Light Punch",
				"fr": "Poing léger"
			},
			"damage": 10
		},
		{
			"cost": [
				"Lightning",
				"Lightning",
				"Colorless"
			],
			"name": {
				"en": "Shock Bolt",
				"fr": "Choc’éclair"
			},
			"effect": {
				"en": "Flip a coin. If tails, discard all Lightning Energy attached to Electabuzz.",
				"fr": "Lancez une pièce. Si c’est pile, défaussez toutes les cartes Énergie Lightning attachées à Elektek."
			},
			"damage": 60
		}
	],
	"category": "Pokemon",
	"description": {
		"en": "Its body constantly discharges electricity. Getting close to it will make your hair stand on end."
	},
	"dexId": [
		125
	],
	"hp": 70,
	"illustrator": "TOKIYA",
	"name": {
		"en": "Electabuzz",
		"fr": "Elektek"
	},
	"rarity": "Uncommon",
	"resistances": [
		{
			"type": "Metal",
			"value": "-20"
		}
	],
	"retreat": 2,
	"set": "hgss4",
	"stage": "Basic",
	"types": [
		"Lightning"
	],
	"variants": {
		"normal": true,
		"reverse": true,
		"holo": false,
		"firstEdition": false
	},
	"weaknesses": [
		{
			"type": "Fighting",
			"value": "×2"
		}
	]
}