{
	"$schema": "../../../meta/definitions/card.schema.json",
	"category": "Trainer",
	"effect": {
		"fr": "Cherchez un Pokémon de base dans votre deck et placez-le sur votre Banc. Mélangez ensuite votre deck.",
		"en": "Search your deck for a Basic Pokémon and put it onto your Bench. Then, shuffle your deck.",
		"es": "Busca en tu baraja 1 Pokémon Básico y ponlo en tu Banca. Después, baraja las cartas de tu baraja.",
		"it": "Cerca nel tuo mazzo un Pokémon Base e mettilo nella tua panchina. Poi rimischia le carte del tuo mazzo.",
		"pt": "Procure por 1 Pokémon Básico no seu baralho e coloque-o no seu Banco. Em seguida, embaralhe o seu baralho.",
		"de": "Durchsuche dein Deck nach 1 Basis-Pokémon und lege es auf deine Bank. Mische anschließend dein Deck."
	},
	"illustrator": "Toyste Beach",
	"name": {
		"de": "Nestball",
		"en": "Nest Ball",
		"es": "Nido Ball",
		"fr": "Faiblo Ball",
		"it": "Minor Ball",
		"pt": "Bola de Ninho"
	},
	"rarity": "Uncommon",
	"set": "sm1",
	"trainerType": "Item"
}