{
	"$schema": "../../../meta/definitions/card.schema.json",
	"attacks": [
		{
			"cost": [
				"Fighting",
				"Colorless",
				"Colorless"
			],
			"name": {
				"en": "Rouse",
				"fr": "Éveiller"
			},
			"effect": {
				"en": "Does 20 damage plus 10 more damage for each damage counter on Piloswine. Then, remove 4 damage counters from Piloswine.",
				"fr": "Inflige 20 dégâts plus 10 dégâts supplémentaires pour chaque marqueur de dégât sur Cochignon. Ensuite, retirez à Cochignon 4 marqueurs de dégât."
			},
			"damage": "20+"
		},
		{
			"cost": [
				"Fighting",
				"Colorless",
				"Colorless",
				"Colorless"
			],
			"name": {
				"en": "Overrun",
				"fr": "Dépassement"
			},
			"effect": {
				"en": "Does 20 damage to 1 of your opponent's Benched Pokémon. (Don't apply Weakness and Resistance for Benched Pokémon.)",
				"fr": "Inflige 20 dégâts à 1 des Pokémon de Banc de votre adversaire. (Vous ne pouvez pas appliquer la Faiblesse et la Résistance aux Pokémon de Banc.)"
			},
			"damage": 60
		}
	],
	"category": "Pokemon",
	"description": {
		"fr": "Il ne voit rien à cause de sa fourrure touffue et se repère à l'aide de son nez délicat."
	},
	"dexId": [
		221
	],
	"evolveFrom": {
		"en": "Swinub",
		"fr": "Marcacrin"
	},
	"hp": 90,
	"illustrator": "Mitsuhiro Arita",
	"name": {
		"en": "Piloswine",
		"fr": "Cochignon"
	},
	"rarity": "Uncommon",
	"resistances": [
		{
			"type": "Lightning",
			"value": "-20"
		}
	],
	"retreat": 2,
	"set": "dp7",
	"stage": "Stage1",
	"types": [
		"Fighting"
	],
	"weaknesses": [
		{
			"type": "Grass",
			"value": "+20"
		}
	]
}